{
  "job_id": "replay_20260314_153000_a1b2",
  "job_type": "replay",
  "created_at": "2026-03-14T15:30:00Z",
  "symbol": "EURUSD",
  "timeframe": 240,
  "date_from": "2026-01-01",
  "date_to": "2026-03-01",
  "ea_name": "ForexStrategyExecutor",
  "ea_params": {
    "MagicNumber": "12345",
    "DryRun": "true",
    "ParamFilePath": "signal_pack.json"
  },
  "output_path": "results/replay_20260314_153000_a1b2/",
  "timeout_seconds": 600,
  "meta": {
    "triggered_by": "blockcell_agent",
    "note": "验证 signal_pack v20260314-1500 在 Q1 历史数据上的命中率"
  }
}
